title,url,is_daily_report,paragraph_index,paragraph
"Summary report, 11–22 November 2024",https://enb.iisd.org/baku-un-climate-change-conference-cop29-summary,False,195,"GRUPO SUR supported addressing the transition of CDM afforestation and reforestation projects to the Article 6.4 mechanism. Several parties questioned the EU’s proposal to request the Supervisory Body to consider the additionality of CDM projects that are requesting transition, noting existing rules on CDM additionality and on transitioning CDM projects to the Article 6.4 mechanism. "
"Summary report, 11–22 November 2024",https://enb.iisd.org/baku-un-climate-change-conference-cop29-summary,False,196,"Final Outcomes: In its decision (FCCC/PA/CMA/2024/L.1), the CMA, inter alia:"
"Summary report, 11–22 November 2024",https://enb.iisd.org/baku-un-climate-change-conference-cop29-summary,False,197,takes note of the Supervisory Body’s adoption of the “Standard: Application of the requirements of Chapter V.B (Methodologies) for the development and assessment of Article 6.4 mechanism methodologies” and the “Standard: Requirements for activities involving removals under the Article 6.4 mechanism”; and
"Summary report, 11–22 November 2024",https://enb.iisd.org/baku-un-climate-change-conference-cop29-summary,False,198,"notes that the Supervisory Body will expeditiously elaborate the standards referred to above, while striving to ensure regulatory stability, and will report on the progress made on the application of those standards in its annual report to the CMA."
"Summary report, 11–22 November 2024",https://enb.iisd.org/baku-un-climate-change-conference-cop29-summary,False,199,"In its decision (FCCC/PA/CMA/2024/L.16), the CMA, inter alia:"
"Summary report, 11–22 November 2024",https://enb.iisd.org/baku-un-climate-change-conference-cop29-summary,False,200,"requests the Article 6.4 Supervisory Body to engage, in consultation with interested stakeholders, further independent scientific and technical expertise and local communities, and include the knowledge, sciences and practices of Indigenous Peoples, as relevant, to support its work, including through its expert panels, to review proposals as necessary and receive independent scientific and technical advice;"
"Summary report, 11–22 November 2024",https://enb.iisd.org/baku-un-climate-change-conference-cop29-summary,False,201,"requests the Supervisory Body, while ensuring ongoing continuous improvements to reflect the best available science, to strive to ensure regulatory stability by avoiding frequent substantive revisions to its adopted standards, tools, and procedures;"
"Summary report, 11–22 November 2024",https://enb.iisd.org/baku-un-climate-change-conference-cop29-summary,False,202,"encourages the Supervisory Body to expedite its work on further standards, tools, and guidelines relating to baselines, downward adjustment, standardized baselines, suppressed demand, additionality, and leakage, as well as non-permanence and reversals including aspects of post-crediting period monitoring, reversal risk assessments, and remediation measures;"
"Summary report, 11–22 November 2024",https://enb.iisd.org/baku-un-climate-change-conference-cop29-summary,False,203,"decides the host party may authorize, for use toward achievement of NDCs and/or for other international mitigation purposes, mitigation contribution Article 6.4 emission reductions already issued by providing to the Supervisory Body a statement of authorization within the specified time frame referred to below, which applies from the date of issuance prior to any transfer of the mitigation contribution Article 6.4 emission reductions in or out of the mechanism registry, and applying the requirements for corresponding adjustments with respect to the corresponding mitigation contribution Article 6.4 emission reductions already forwarded for share of proceeds for adaptation, and canceled to deliver overall mitigation in global emissions;"
"Summary report, 11–22 November 2024",https://enb.iisd.org/baku-un-climate-change-conference-cop29-summary,False,204,"requests the Supervisory Body to consider and determine whether, based on its experience, there is a need to set a time limit, from the date of issuance to when the host party shall provide a statement of authorization, and report back in its annual report to CMA 7; and"
"Summary report, 11–22 November 2024",https://enb.iisd.org/baku-un-climate-change-conference-cop29-summary,False,205,"decides the participating party registries may voluntarily connect to the mechanism registry, and the connection shall enable the transfer of authorized Article 6.4 emission reductions, while ensuring avoidance of double counting and the ability to pull and view data and information on holdings and the action history of authorized Article 6.4 ERs."
"Summary report, 11–22 November 2024",https://enb.iisd.org/baku-un-climate-change-conference-cop29-summary,False,206,"Work Programme under the Framework for Non-Market Approaches referred to in Article 6.8: Article 6.8 of the Paris Agreement defines a framework for non-market approaches (NMAs) which aim to assist parties in the implementation of their NDCs and to promote mitigation and adaptation ambition, in the context of sustainable development and poverty eradication. This sub-item was considered in a contact group and informal consultations under the SBSTA on 12 and 13 November, co-facilitated and co-chaired by Kristin Qui (Samoa) and Jacqui Ruesga (New Zealand)."
"Summary report, 11–22 November 2024",https://enb.iisd.org/baku-un-climate-change-conference-cop29-summary,False,207,"One of the tasks for parties during this meeting was to undertake an “expedited and simple assessment” of the progress and outcomes of the first phase (2023-2024) of the work programme under the NMA framework, to improve and recommend the schedule for implementing the second phase (2025-2026). During the opening contact group, the Secretariat highlighted: there are no NMAs recorded on the web-based platform yet; and 78 national focal points have been designated, up from 52 at SBSTA 60."
"Summary report, 11–22 November 2024",https://enb.iisd.org/baku-un-climate-change-conference-cop29-summary,False,208,"On phase one assessment, the LMDCs proposed undertaking a quantitative assessment of how NMAs have helped countries implement their NDCs. The COALITION FOR RAINFOREST NATIONS and the LMDCs urged continued consideration of phase one topics even during phase two, saying these have not been properly addressed."
"Summary report, 11–22 November 2024",https://enb.iisd.org/baku-un-climate-change-conference-cop29-summary,False,209,"On phase two, recommendations included: using spin-off groups to deep dive into specific topics, with parties facilitating; and updating the web-based platform to enable the registration of individual NMAs."
"Summary report, 11–22 November 2024",https://enb.iisd.org/baku-un-climate-change-conference-cop29-summary,False,210,"Final Outcome: In its conclusions (FCCC/SBSTA/2024/L.15), the SBSTA, inter alia. welcomed the expedited and simple assessment of the first phase of implementing the work programme activities, undertaken with a view to improving and recommending the schedule for implementing the work programme activities for the second phase, and recommends a draft decision for adoption by the CMA."
"Summary report, 11–22 November 2024",https://enb.iisd.org/baku-un-climate-change-conference-cop29-summary,False,211,"In its decision (FCCC/SBSTA/2024/L.15/Add.1), the CMA, inter alia:"
"Summary report, 11–22 November 2024",https://enb.iisd.org/baku-un-climate-change-conference-cop29-summary,False,212,"notes, in the first phase, parties have identified and framed all relevant elements of the work programme activities, and the Secretariat has developed the NMA Platform and an associated user manual;"
"Summary report, 11–22 November 2024",https://enb.iisd.org/baku-un-climate-change-conference-cop29-summary,False,213,recalls the second phase will focus on fully implementing the work programme activities;
"Summary report, 11–22 November 2024",https://enb.iisd.org/baku-un-climate-change-conference-cop29-summary,False,214,"requests the Secretariat to provide regular updates on the status of the development of the NMA Platform and provide a quantitative report on the activities on the NMA Platform for each meeting of the Glasgow Committee on NMAs, which may include the number of nominated Article 6.8 national focal points, the number of submitted NMAs, and other relevant information;"
"Summary report, 11–22 November 2024",https://enb.iisd.org/baku-un-climate-change-conference-cop29-summary,False,215,encourages interested parties to showcase examples of NMAs by recording them on the NMA Platform; and
"Summary report, 11–22 November 2024",https://enb.iisd.org/baku-un-climate-change-conference-cop29-summary,False,216,invites submissions on: barriers to using the NMA Platform and potential solutions; engagement with the NMA Platform and the challenges encountered in unlocking its full potential; and how NMAs can support a party’s implementation of its NDC.
"Summary report, 11–22 November 2024",https://enb.iisd.org/baku-un-climate-change-conference-cop29-summary,False,217,"Further guidance on NDC features: The CMA agreed in 2018 to discuss further guidance on the features of NDCs in 2024, before the next round of NDCs is due in 2025. The CMA considered this item in a contact group co-chaired by Sin Liang Cheah (Singapore) and Federica Fricano (Italy), which met on 13, 16, and 19 November."
"Summary report, 11–22 November 2024",https://enb.iisd.org/baku-un-climate-change-conference-cop29-summary,False,218,"Throughout the discussions, parties could not agree on what an NDC feature is, and, therefore, whether guidance on additional features would be needed. While AOSIS, the EIG, and others cited potential additional features such as NDCs being aligned with the 1.5°C goal, the LMDCs and ARAB GROUP stressed that NDCs are nationally determined, and additional features should not be specified."
"Summary report, 11–22 November 2024",https://enb.iisd.org/baku-un-climate-change-conference-cop29-summary,False,219,"Parties could not agree whether to conclude this item, defer it to another date, or continue discussions with a view to informing the 2025 NDCs."
"Summary report, 11–22 November 2024",https://enb.iisd.org/baku-un-climate-change-conference-cop29-summary,False,220,Final Outcome: The CMA decided to continue consideration of this matter at CMA 8 (November 2026).
"Summary report, 11–22 November 2024",https://enb.iisd.org/baku-un-climate-change-conference-cop29-summary,False,221,"Periodic review of the long-term global goal under the Convention and of overall progress toward achieving it: In 2010, under the COP, parties agreed on a long-term global goal to reduce GHG emissions to hold the increase in global average temperature below 2°C above pre-industrial levels, and decided to periodically review the adequacy of and progress toward this goal at least every seven years. The outcome of the first review (2013-2015) was a contributing factor to the Paris Agreement’s objective of pursuing efforts to limit the temperature increase to 1.5°C above pre-industrial levels. The second periodic review concluded in 2022. This agenda item was considered in a contact group co-chaired by Jolene Cook (UK) and Leon Charles (Grenada), which met, among others, on    20 November."
"Summary report, 11–22 November 2024",https://enb.iisd.org/baku-un-climate-change-conference-cop29-summary,False,222,"Parties could not agree on whether to continue the periodic review. The US and others viewed it as redundant to the GST, while the LDCs and others proposed preparing for future periodic reviews. Views diverged on when to discuss this issue again."
"Summary report, 11–22 November 2024",https://enb.iisd.org/baku-un-climate-change-conference-cop29-summary,False,223,"Final Outcome: In its decision (FCCC/CP/2024/L.7), the COP decides to continue considering this matter at COP 30."
"Summary report, 11–22 November 2024",https://enb.iisd.org/baku-un-climate-change-conference-cop29-summary,False,224,"Emissions from fuel used for international aviation and maritime transport: This agenda item was considered in informal consultations on 14 November, among others, co-facilitated by Jakob Wiesbauer-Lenz (EU) and Pacifica Achieng Ogola (Kenya). Parties reiterated long-standing divergent views and could not agree on text that: acknowledges the presence of International Civil Aviation Organization and International Maritime Organization representatives at the session; requests these bodies to assess the impacts of their proposed goals on developing countries; and references the principle of common but differentiated responsibilities."
"Summary report, 11–22 November 2024",https://enb.iisd.org/baku-un-climate-change-conference-cop29-summary,False,225,"Final Outcome: In its closing plenary on 18 November, the SBSTA agreed to continue consideration of this agenda item at SBSTA 62."
"Summary report, 11–22 November 2024",https://enb.iisd.org/baku-un-climate-change-conference-cop29-summary,False,226,"Matters relating to the Clean Development Mechanism (CDM): The CDM is a market mechanism established under the Kyoto Protocol. This item was considered in informal consultations under the SBSTA on 14 and 15 November, and in a contact group and informal consultations under the CMP on 18 and 19 November, both co-facilitated by Karoliina Anttonen (Finland) and Alick Muvundika (Zambia). The two main issues discussed were: setting timelines for the phased discontinuation of the CDM’s operations, processes, and institutions; and transferring funds from the CDM Trust Fund to other areas. Regarding the latter, the three main destination options were: the Adaptation Fund; Article 6.4 capacity building; or Article 6 infrastructure."
"Summary report, 11–22 November 2024",https://enb.iisd.org/baku-un-climate-change-conference-cop29-summary,False,227,"Following discussions of these issues under the SBSTA, parties were unable to reach any agreement, and in accordance with Rule 16, the matter will be included in the provisional agenda for SBSTA 62. However, as the agenda item was also on the CMP agenda, the CMP continued consideration of this during the second week."
"Summary report, 11–22 November 2024",https://enb.iisd.org/baku-un-climate-change-conference-cop29-summary,False,228,"During the SBSTA and CMP informal consultations, the Secretariat responded to clarification questions raised by parties on matters such as the projected year-end balance of the CDM Trust Fund. They elaborated on the various uncertainties relating to liabilities from staff allocations and processing fees from issuances, noting an accurate estimate will only be possible once countries have decided on the deadline for issuances. The Secretariat noted that, with certainty, USD 12.78 million would be available for 2025."
"Summary report, 11–22 November 2024",https://enb.iisd.org/baku-un-climate-change-conference-cop29-summary,False,229,"Most parties, including AOSIS, the EU, AILAC, and others, supported setting the earliest date possible for ceasing CDM activities. The LMDCs, the ARAB GROUP, and BRAZIL opposed a decision on timelines at this session and preferred to continue consideration of the matter at CMP 20. The LMDCs pointed to discussions under Article 6.4 about additional requirements that could prevent many CDM projects from transitioning to the Article 6.4 mechanism and opposed “stranding” such projects."
"Summary report, 11–22 November 2024",https://enb.iisd.org/baku-un-climate-change-conference-cop29-summary,False,230,"Most parties supported transfer to the Adaptation Fund, with divergent views about additional destinations, if any. The UK supported transferring to both the Adaptation Fund and Article 6 activities, preferring not to specify which Article 6 activities would benefit from the transfer. The EIG noted that transferring funds to Article 6 should be an allocation, not a loan. The LMDCs expressed willingness to consider transfer to the Adaptation Fund only. The AFRICAN GROUP reiterated their preference to transfer funds to both the Adaptation Fund and for Article 6 capacity building, but proposed, supported by AOSIS, an alternative option of transferring to the Adaptation Fund only."
"Summary report, 11–22 November 2024",https://enb.iisd.org/baku-un-climate-change-conference-cop29-summary,False,231,"In the closing contact group meeting, the Co-Chairs noted lack of consensus on the text and reported they will forward the bracketed draft text to the Presidency, which eventually reached agreement."
"Summary report, 11–22 November 2024",https://enb.iisd.org/baku-un-climate-change-conference-cop29-summary,False,232,"Final Outcome: In its decision (FCCC/KP/CMP/2024/L.3), the CMP, inter alia:"
"Summary report, 11–22 November 2024",https://enb.iisd.org/baku-un-climate-change-conference-cop29-summary,False,233,"takes note of the work undertaken from 28 September 2023 - 7 November 2024 by the Executive Board, its panels, and the Secretariat in overseeing the implementation of the CDM and maintaining stakeholder engagement in its operations;"
"Summary report, 11–22 November 2024",https://enb.iisd.org/baku-un-climate-change-conference-cop29-summary,False,234,designates as operational entities those entities that have been accredited and provisionally designated as such by the Executive Board to carry out sectoral scope-specific validation and/or verification functions as set out in the annex; and
"Summary report, 11–22 November 2024",https://enb.iisd.org/baku-un-climate-change-conference-cop29-summary,False,235,"takes note of the progress made by the Executive Board in addressing the issue of non-responsive designated national authorities and requests the Executive Board to continue following up with non-responsive designated national authorities, as necessary."
"Summary report, 11–22 November 2024",https://enb.iisd.org/baku-un-climate-change-conference-cop29-summary,False,236,Report on the high-level ministerial roundtable on increased ambition of Kyoto Protocol commitments: President Babayev reported that Presidency consultations did not yield agreement and Rule 16 would apply.
"Summary report, 11–22 November 2024",https://enb.iisd.org/baku-un-climate-change-conference-cop29-summary,False,237,Adaptation
"Summary report, 11–22 November 2024",https://enb.iisd.org/baku-un-climate-change-conference-cop29-summary,False,238,"Matters relating to the Global Goal on Adaptation: The GGA of enhancing adaptive capacity, strengthening resilience, and reducing vulnerability to climate change was established by Article 7 of the Paris Agreement. At CMA 3, parties launched a work programme to flesh out the GGA in more detail. At CMA 5 they established the GGA Framework that includes a range of thematic and dimensional targets for climate adaptation and resilience, and launched a process aimed at defining adaptation indicators."
"Summary report, 11–22 November 2024",https://enb.iisd.org/baku-un-climate-change-conference-cop29-summary,False,239,"Discussions on this agenda item first occurred in SB informal consultations co-facilitated by Tina Kobilšek (Slovenia) and Lamin Dibba (The Gambia) on 12, 13, 15, and 16 November. Parties engaged with a report on progress in defining adaptation indicators (FCCC/SB/2024/6). They agreed that further guidance to the expert group was needed, but expressed differing views about: the precise number and content of indicators; how to strike a balance between indicators’ global aggregability and their specificity to regional and national contexts; and whether there should be indicators to track MoI, which many developing countries favored but the EU, the UK, JAPAN, and CANADA, among others, rejected. There was further disagreement about: the need for a standalone agenda item on the GGA; the relationship between the GGA and the GST; and whether to engage in substantive discussions on the Secretariat’s technical paper on transformational adaptation (FCCC/TP/2024/8), given its late publication. In their conclusions (FCCC/SB/2024/L.12), the SBs agreed to forward a draft decision to CMA 6."
"Summary report, 11–22 November 2024",https://enb.iisd.org/baku-un-climate-change-conference-cop29-summary,False,240,"Discussions on the draft decision continued in CMA informal consultations on 19 November, and later in ministerial and Presidency consultations co-facilitated by Franz Tattenbach Capra (Costa Rica) and Eamon Ryan (Ireland) on 20 November, among others."
"Summary report, 11–22 November 2024",https://enb.iisd.org/baku-un-climate-change-conference-cop29-summary,False,241,"Final Outcome: In its decision (FCCC/PA/CMA/2024/L.20), the CMA, among others, with regard to the GGA indicators:"
"Summary report, 11–22 November 2024",https://enb.iisd.org/baku-un-climate-change-conference-cop29-summary,False,242,acknowledges the significant progress made by the technical experts in their work on indicators;
"Summary report, 11–22 November 2024",https://enb.iisd.org/baku-un-climate-change-conference-cop29-summary,False,243,confirms that CMA 7 will decide on a final list of indicators;
"Summary report, 11–22 November 2024",https://enb.iisd.org/baku-un-climate-change-conference-cop29-summary,False,244,"recognizes that further guidance is required for the experts to apply common approaches and methodologies, enhance collaboration across thematic and dimensional targets, and prioritize reducing the number of global indicators;"
"Summary report, 11–22 November 2024",https://enb.iisd.org/baku-un-climate-change-conference-cop29-summary,False,245,identifies additional criteria for the experts to consider;
"Summary report, 11–22 November 2024",https://enb.iisd.org/baku-un-climate-change-conference-cop29-summary,False,246,"decides that the final outcomes may include a manageable set of no more than 100 indicators that are globally applicable and constitute a menu that captures various contexts of adaptation action, enabling parties to choose which indicators they will report on;"
"Summary report, 11–22 November 2024",https://enb.iisd.org/baku-un-climate-change-conference-cop29-summary,False,247,"decides that indicators should, among others, capture specific ecosystems, the vulnerability of children, and track MoI; and"
"Summary report, 11–22 November 2024",https://enb.iisd.org/baku-un-climate-change-conference-cop29-summary,False,248,requests the SB Chairs to invite the experts to submit their input on indicators in time to enable the issuance of reports no later than four weeks prior to SB 62.
"Summary report, 11–22 November 2024",https://enb.iisd.org/baku-un-climate-change-conference-cop29-summary,False,249,"On the relationship between the GGA and the GST, the CMA:"
"Summary report, 11–22 November 2024",https://enb.iisd.org/baku-un-climate-change-conference-cop29-summary,False,250,decides that party reporting on indicators should feed into the technical phase of the GST process by specifying a way to structure and inform the assessment of progress in adaptation;
"Summary report, 11–22 November 2024",https://enb.iisd.org/baku-un-climate-change-conference-cop29-summary,False,251,calls on parties to update their adaptation communications and prepare their BTRs taking into account the GGA Framework and requests the Secretariat to review progress toward achieving the GGA targets and report on its findings in the synthesis report to be prepared as part of the second GST; and
"Summary report, 11–22 November 2024",https://enb.iisd.org/baku-un-climate-change-conference-cop29-summary,False,252,decides to undertake the review of the GGA Framework after the second GST.
"Summary report, 11–22 November 2024",https://enb.iisd.org/baku-un-climate-change-conference-cop29-summary,False,253,The CMA further:
"Summary report, 11–22 November 2024",https://enb.iisd.org/baku-un-climate-change-conference-cop29-summary,False,254,affirms that the agenda item on matters relating to the GGA is a standing agenda item;
"Summary report, 11–22 November 2024",https://enb.iisd.org/baku-un-climate-change-conference-cop29-summary,False,255,establishes a high-level dialogue on adaptation to be convened on the margins of each CMA session;
"Summary report, 11–22 November 2024",https://enb.iisd.org/baku-un-climate-change-conference-cop29-summary,False,256,welcomes the work of the IPCC in revising and updating its 1994 Technical Guidelines for Assessing Climate Change Impacts and Adaptations and invites the SBSTA to organize a special event at SB 62 for the IPCC to provide an update on its ongoing work; and
"Summary report, 11–22 November 2024",https://enb.iisd.org/baku-un-climate-change-conference-cop29-summary,False,257,takes note of the Secretariat’s technical paper on transformational adaptation and requests the Secretariat to prepare a reader-friendly summary of the paper.
"Summary report, 11–22 November 2024",https://enb.iisd.org/baku-un-climate-change-conference-cop29-summary,False,258,"Report of the Adaptation Committee: The Adaptation Committee aims to promote the coherent implementation of enhanced action on adaptation. The Adaptation Committee was established in 2010 as part of the Cancun Adaptation Framework to drive forward coherent UNFCCC action on adaptation worldwide by providing expert guidance, enhancing outreach, and supporting the implementation of the Convention and the Paris Agreement. At SB 60, it was decided to consider the Adaptation Committee report and the Adaptation Committee review separately to facilitate agreement."
